{
  "$schema": "https://json-schema.org/draft/2020-12/schema",
  "type": "object",
  "properties": {
    "schemaVersion": {
      "type": "number",
      "const": 1
    },
    "festivalYear": {
      "type": "integer",
      "minimum": -9007199254740991,
      "maximum": 9007199254740991
    },
    "exportedAt": {
      "type": "string"
    },
    "films": {
      "type": "object",
      "propertyNames": {
        "type": "string"
      },
      "additionalProperties": {
        "type": "object",
        "properties": {
          "tristan": {
            "type": "boolean"
          },
          "amy": {
            "type": "boolean"
          },
          "priority": {
            "type": "boolean"
          },
          "maybe": {
            "type": "boolean"
          },
          "notes": {
            "type": "string"
          },
          "pinnedScreeningId": {
            "type": [
              "string",
              "null"
            ]
          },
          "excludedScreeningIds": {
            "type": "array",
            "items": {
              "type": "string"
            }
          },
          "updatedAt": {
            "type": "string"
          }
        },
        "required": [
          "tristan",
          "amy",
          "priority",
          "maybe",
          "updatedAt"
        ],
        "additionalProperties": false
      }
    },
    "manualEvents": {
      "type": "array",
      "items": {
        "type": "object",
        "properties": {
          "id": {
            "type": "string",
            "pattern": "^manual-"
          },
          "title": {
            "type": "string",
            "minLength": 1
          },
          "runtimeMinutes": {
            "anyOf": [
              {
                "type": "integer",
                "exclusiveMinimum": 0,
                "maximum": 9007199254740991
              },
              {
                "type": "null"
              }
            ]
          },
          "flags": {
            "type": "object",
            "properties": {
              "tristan": {
                "type": "boolean"
              },
              "amy": {
                "type": "boolean"
              },
              "priority": {
                "type": "boolean"
              },
              "maybe": {
                "type": "boolean"
              }
            },
            "required": [
              "tristan",
              "amy",
              "priority",
              "maybe"
            ],
            "additionalProperties": false
          },
          "screenings": {
            "minItems": 1,
            "type": "array",
            "items": {
              "type": "object",
              "properties": {
                "id": {
                  "type": "string",
                  "minLength": 1
                },
                "start": {
                  "type": "string",
                  "pattern": "^\\d{4}-\\d{2}-\\d{2}T\\d{2}:\\d{2}(:\\d{2})?[+-]\\d{2}:\\d{2}$"
                },
                "venue": {
                  "type": "string",
                  "minLength": 1
                },
                "screen": {
                  "type": [
                    "string",
                    "null"
                  ]
                }
              },
              "required": [
                "id",
                "start",
                "venue",
                "screen"
              ],
              "additionalProperties": false
            }
          },
          "notes": {
            "type": [
              "string",
              "null"
            ]
          },
          "updatedAt": {
            "type": "string"
          }
        },
        "required": [
          "id",
          "title",
          "runtimeMinutes",
          "flags",
          "screenings",
          "notes",
          "updatedAt"
        ],
        "additionalProperties": false
      }
    }
  },
  "required": [
    "schemaVersion",
    "festivalYear",
    "films",
    "manualEvents"
  ],
  "additionalProperties": false
}
